Symbol,Name,Last Sale,Net Change,% Change,Market Cap,Country,IPO Year,Volume,Sector,Industry
KEY^I,KeyCorp Depositary Shares Each Representing a 1/40th Ownership Interest in a Share of Fixed-to-Floating Rate Perpetual Non-Cumulative Preferred Stock Series E,$24.87,-0.02,-0.08%,,United States,,45830,,
KEY^J,KeyCorp Depositary Shares each representing a 1/40th ownership interest in a share of Fixed Rate Perpetual Non-Cumulative Preferred Stock Series F,$21.66,0.03,0.139%,,United States,,11977,,
KEY^K,KeyCorp Depositary Shares each representing a 1/40th ownership interest in a share of Fixed Rate Perpetual Non-Cumulative Preferred Stock Series G,$21.61,0.00,0.00%,,United States,,17839,,
KEY^L,KeyCorp Depositary Shares each representing a 1/40th ownership interest in a share of Fixed Rate Perpetual Non-Cumulative Preferred Stock Series H,$24.62,-0.03,-0.122%,,United States,,37595,,
KEYS,Keysight Technologies Inc. Common Stock,$163.51,1.06,0.653%,28141519535.00,United States,2014,1048032,Industrials,Industrial Machinery/Components
KF,Korea Fund Inc. (The) New Common Stock,$26.99,0.60,2.274%,0.00,United States,,1272,Finance,Investment Managers
KFFB,Kentucky First Federal Bancorp Common Stock,$3.00,0.00,0.00%,24260145.00,United States,2005,2081,Finance,Savings Institutions
KFII,K&F Growth Acquisition Corp. II Class A Ordinary shares,$10.18,0.00,0.00%,0.00,United States,2025,59952,,
KFIIR,K&F Growth Acquisition Corp. II Rights,$0.145,-0.005,-3.333%,0.00,United States,2025,120491,,
KFIIU,K&F Growth Acquisition Corp. II Unit,$10.30,0.00,0.00%,0.00,United States,2025,110,Finance,Blank Checks
KFRC,Kforce Inc. Common Stock,$43.68,1.54,3.654%,813758400.00,United States,1995,154045,Consumer Discretionary,Professional Services
KFS,Kingsway Financial Services Inc. Common Stock (DE),$15.25,-0.95,-5.864%,419941553.00,Canada,,135483,Finance,Property-Casualty Insurers
KFY,Korn Ferry Common Stock,$73.81,0.44,0.60%,3832289010.00,United States,1999,741741,Consumer Discretionary,Diversified Commercial Services
KG,Kestrel Group Ltd.,$25.03,0.72,2.962%,194928959.00,Bermuda,2008,48243,Finance,Property-Casualty Insurers
KGC,Kinross Gold Corporation Common Stock,$15.19,-0.86,-5.358%,18635092000.00,Canada,2001,23836277,Basic Materials,Precious Metals
KGEI,Kolibri Global Energy Inc. Common stock,$6.39,0.14,2.24%,226543731.00,United States,,208457,Energy,Oil & Gas Production
KGS,Kodiak Gas Services Inc. Common Stock,$32.45,-0.30,-0.916%,2851031072.00,United States,2023,1090156,Utilities,Natural Gas Distribution
KHC,The Kraft Heinz Company Common Stock,$26.43,0.35,1.342%,31281017729.00,United States,,12623998,Consumer Staples,Packaged Foods
KIDS,OrthoPediatrics Corp. Common Stock,$21.68,0.44,2.072%,536992982.00,United States,2017,180099,Health Care,Medical/Dental Instruments
KIDZ,Classover Holdings Inc. Class B Common Stock,$2.84,0.10,3.65%,67277138.00,United States,,203351,Real Estate,Other Consumer Services
KIDZW,Classover Holdings Inc. Warrants,$0.125,0.01,8.696%,2961142.00,United States,,46933,,
KIM,Kimco Realty Corporation (HC) Common Stock,$21.08,-0.13,-0.613%,14260542004.00,United States,,5445838,Real Estate,Real Estate Investment Trusts
KIM^L,Kimco Realty Corporation Class L Depositary Shares each of which represents a one-one thousandth fractional interest in a share of 5.125% Class L Cumulative Redeemable Preferred Stock liquidation preference $25000.00 per share,$20.13,0.23,1.156%,,United States,,14185,,
KIM^M,Kimco Realty Corporation Class M Depositary Shares each of which represents a one-one thousandth fractional interest in a share of 5.25% Class M Cumulative Redeemable Preferred Stock liquidation preference $25000.00 per share,$20.26,0.08,0.396%,,United States,,15258,,
KIM^N,Kimco Realty Corporation Depositary Shares each representing 1/1000th interest in a share of 7.25% Class N Cumulative Convertible Perpetual Preferred Stock,$58.80,-0.325,-0.55%,,United States,,780,,
KIND,Nextdoor Holdings Inc. Class A Common Stock,$1.61,-0.02,-1.227%,615967414.00,United States,,1612222,Technology,Computer Software: Programming Data Processing
KINS,Kingstone Companies Inc. Common Stock,$15.45,-0.11,-0.707%,216389564.00,United States,,256384,Finance,Property-Casualty Insurers
KIO,KKR Income Opportunities Fund Common Shares,$12.52,-0.01,-0.08%,0.00,United States,2013,248420,Finance,Investment Managers
KIRK,Kirkland's Inc. COMMONSTOCK,$1.18,0.00,0.00%,26504432.00,United States,2002,69751,Consumer Discretionary,Other Specialty Stores
KITT,Nauticus Robotics Inc. Common stock,$1.03,-0.04,-3.738%,38418577.00,United States,2021,1760664,Industrials,Industrial Machinery/Components
KITTW,Nauticus Robotics Inc. Warrant,$0.0881,-0.0018,-2.002%,3286094.00,United States,2021,20240,Industrials,Industrial Machinery/Components
KKR,KKR & Co. Inc. Common Stock,$137.94,2.40,1.771%,122855144100.00,United States,,4452126,Finance,Investment Managers
KKR^D,KKR & Co. Inc. 6.25% Series D Mandatory Convertible Preferred Stock,$55.16,0.91,1.677%,,United States,,258724,,
KKRS,KKR Group Finance Co. IX LLC 4.625% Subordinated Notes due 2061,$17.74,0.02,0.113%,15799987359.00,United States,2021,8795,,
KKRT,KKR & Co. Inc. 6.875% Subordinated Notes due 2065,$25.58,-0.06,-0.234%,0.00,United States,2025,54144,Finance,Investment Managers
KLAC,KLA Corporation Common Stock,$919.22,6.60,0.723%,121558967285.00,United States,1980,862542,Technology,Electronic Components
KLC,KinderCare Learning Companies Inc. Common Stock,$9.68,0.43,4.649%,1142301236.00,United States,2024,670973,Consumer Discretionary,Other Consumer Services
KLG,WK Kellogg Co Common Stock,$16.91,-0.20,-1.169%,1458702680.00,United States,2023,2214457,Consumer Staples,Packaged Foods
KLIC,Kulicke and Soffa Industries Inc. Common Stock,$36.85,1.16,3.25%,1944550474.00,Singapore,,467767,Technology,Semiconductors
KLRS,Kalaris Therapeutics Inc. Common Stock,$2.58,-0.03,-1.149%,48252238.00,United States,2020,11765,Health Care,Biotechnology: Biological Products (No Diagnostic Substances)
KLTO,Klotho Neurosciences Inc. Common Stock,$1.34,0.01,0.752%,43542481.00,United States,2022,4252381,Health Care,Biotechnology: Biological Products (No Diagnostic Substances)
KLTOW,Klotho Neurosciences Inc. Warrant,$0.2725,0.03,12.371%,8854721.00,United States,2022,110860,Health Care,Biotechnology: Biological Products (No Diagnostic Substances)
KLTR,Kaltura Inc. Common Stock,$2.01,0.03,1.515%,308774546.00,United States,2021,185837,Technology,Computer Software: Prepackaged Software
KLXE,KLX Energy Services Holdings Inc. Common Stock,$1.96,0.04,2.083%,34405713.00,United States,,209390,Energy,Oilfield Services/Equipment
KMB,Kimberly-Clark Corporation Common Stock,$131.40,-0.25,-0.19%,43600626999.00,United States,,1620506,Consumer Discretionary,Containers/Packaging
KMDA,Kamada Ltd. Ordinary Shares,$7.70,-0.01,-0.13%,442788739.00,Israel,2013,38463,Health Care,Biotechnology: Pharmaceutical Preparations
KMI,Kinder Morgan Inc. Common Stock,$28.13,-0.20,-0.706%,62506793825.00,United States,2011,14130545,Utilities,Natural Gas Distribution
KMPB,Kemper Corporation 5.875% Fixed-Rate Reset Junior Subordinated Debentures due 2062,$24.00,-0.06,-0.249%,1535877864.00,United States,2022,12694,Finance,Property-Casualty Insurers
KMPR,Kemper Corporation,$62.86,-0.21,-0.333%,4022720105.00,United States,,595549,Finance,Property-Casualty Insurers
KMT,Kennametal Inc. Common Stock,$23.86,0.27,1.145%,1818932837.00,United States,,955046,Industrials,Industrial Machinery/Components
KMTS,Kestra Medical Technologies Ltd. Common Stock,$15.78,1.03,6.983%,810281792.00,United States,2025,331327,Health Care,Medical/Dental Instruments
KMX,CarMax Inc,$68.38,-0.40,-0.582%,10261933754.00,United States,,3063327,Consumer Discretionary,Retail-Auto Dealers and Gas Stations
KN,Knowles Corporation Common Stock,$18.08,0.33,1.859%,1572508633.00,United States,2014,463556,Consumer Staples,Consumer Electronics/Appliances
KNDI,Kandi Technologies Group Inc. Ordinary Shares,$1.14,0.03,2.703%,99588387.00,China,,82122,Consumer Discretionary,Auto Manufacturing
KNF,Knife Riv Holding Co. Common Stock,$79.48,0.72,0.914%,4502729652.00,United States,2023,921293,Industrials,Mining & Quarrying of Nonmetallic Minerals (No Fuels)
KNOP,KNOT Offshore Partners LP Common Units representing Limited Partner Interests,$7.04,0.08,1.149%,239677370.00,United Kingdom,2013,81435,Consumer Discretionary,Marine Transportation
KNSA,Kiniksa Pharmaceuticals International plc Class A Ordinary Shares,$27.21,-0.74,-2.648%,1985540012.00,United States,2018,636700,Health Care,Biotechnology: Pharmaceutical Preparations
KNSL,Kinsale Capital Group Inc. Common Stock,$485.19,10.63,2.24%,11310475148.00,United States,,219814,Finance,Property-Casualty Insurers
KNTK,Kinetik Holdings Inc. Class A Common Stock,$42.89,0.12,0.281%,6774976670.00,United States,2022,1198413,Utilities,Natural Gas Distribution
KNW,Know Labs Inc. Common Stock,$3.69,0.78,26.804%,27675000.00,,,2739658,Industrials,Industrial Machinery/Components
KNX,Knight-Swift Transportation Holdings Inc.,$47.03,0.85,1.841%,7621211500.00,United States,2017,2858459,Industrials,Trucking Freight/Courier Services
KO,Coca-Cola Company (The) Common Stock,$70.24,-0.77,-1.084%,302331695677.00,United States,,17107299,Consumer Staples,Beverages (Production/Distribution)
KOD,Kodiak Sciences Inc Common Stock,$3.90,0.19,5.121%,205777810.00,United States,2018,216934,Health Care,Biotechnology: Biological Products (No Diagnostic Substances)
KODK,Eastman Kodak Company Common New,$6.41,0.25,4.058%,517928000.00,United States,,3974293,Consumer Discretionary,Industrial Machinery/Components
KOF,Coca Cola Femsa S.A.B. de C.V.  American Depositary Shares each representing 10 Units (each Unit consists of 3 Series B Shares and 5 Series L Shares),$94.22,-3.77,-3.847%,19794041554.00,Mexico,1993,256434,Consumer Staples,Beverages (Production/Distribution)
KOP,Koppers Holdings Inc. Common Stock,$33.68,0.69,2.092%,673939090.00,United States,2006,178694,Basic Materials,Forest Products
KOPN,Kopin Corporation Common Stock,$1.60,0.04,2.564%,260476675.00,United States,1992,1898923,Technology,Semiconductors
KORE,KORE Group Holdings Inc. Common Stock,$2.45,0.08,3.376%,42042149.00,United States,,27040,Telecommunications,Telecommunications Equipment
KOS,Kosmos Energy Ltd. Common Shares (DE),$2.14,0.13,6.468%,1022939393.00,Bermuda,2011,9120300,Energy,Oil & Gas Production
KOSS,Koss Corporation Common Stock,$5.28,0.00,0.00%,49504198.00,United States,,33416,Consumer Staples,Consumer Electronics/Appliances
KPLT,Katapult Holdings Inc. Common Stock,$7.89,-0.18,-2.23%,35801412.00,United States,2019,22997,Consumer Discretionary,Diversified Commercial Services
KPRX,Kiora Pharmaceuticals Inc.  Common Stock,$2.86,0.05,1.779%,8705431.00,United States,,21597,Health Care,Biotechnology: Pharmaceutical Preparations
KPTI,Karyopharm Therapeutics Inc. Common Stock,$4.65,0.42,9.929%,40175554.00,United States,2013,177730,Health Care,Biotechnology: Pharmaceutical Preparations
KR,Kroger Company (The) Common Stock,$69.74,-1.71,-2.393%,46109008142.00,United States,,6948796,Consumer Staples,Food Chains
KRC,Kilroy Realty Corporation Common Stock,$35.04,0.49,1.418%,4144551593.00,United States,1997,1397239,Real Estate,Real Estate Investment Trusts
KREF,KKR Real Estate Finance Trust Inc. Common Stock,$9.00,0.23,2.623%,610256601.00,United States,2017,768742,Real Estate,Real Estate Investment Trusts
KREF^A,KKR Real Estate Finance Trust Inc. 6.50% Series A Cumulative Redeemable Preferred Stock,$20.0767,-0.1233,-0.61%,,United States,,18262,,
KRG,Kite Realty Group Trust Common Stock,$22.47,-0.18,-0.795%,4939182381.00,United States,2004,1542769,Real Estate,Real Estate Investment Trusts
KRKR,36Kr Holdings Inc. American Depositary Shares,$5.65,0.34,6.403%,222697253.00,China,2019,246,Consumer Discretionary,Business Services
KRMD,KORU Medical Systems Inc. Common Stock (DE),$3.80,0.13,3.542%,175335785.00,United States,,162049,Health Care,Medical/Dental Instruments
KRMN,Karman Holdings Inc. Common Stock,$45.03,-0.21,-0.464%,5951821923.00,,2025,722359,Industrials,Military/Government/Technical
KRNT,Kornit Digital Ltd. Ordinary Shares,$19.42,-0.19,-0.969%,880260108.00,Israel,2015,132282,Industrials,Industrial Machinery/Components
KRNY,Kearny Financial Corp Common Stock,$6.83,-0.01,-0.146%,441079235.00,United States,2005,470787,Finance,Savings Institutions
KRO,Kronos Worldwide Inc Common Stock,$6.48,0.15,2.37%,745435328.00,United States,,172809,Industrials,Major Chemicals
KROS,Keros Therapeutics Inc. Common Stock,$13.91,0.51,3.806%,564960409.00,United States,2020,796888,Health Care,Biotechnology: Pharmaceutical Preparations
KRP,Kimbell Royalty Partners Common Units Representing Limited Partner Interests,$14.23,0.28,2.007%,1535246638.00,United States,2017,300106,Energy,Oil & Gas Production
KRRO,Korro Bio Inc. Common Stock,$13.58,1.00,7.949%,127522881.00,United States,2019,136699,Health Care,Biotechnology: Pharmaceutical Preparations
KRT,Karat Packaging Inc. Common Stock,$29.03,0.17,0.589%,582327430.00,United States,2021,77208,Industrials,Plastic Products
KRUS,Kura Sushi USA Inc. Class A Common Stock,$86.78,0.90,1.048%,1048777000.00,United States,2019,596653,Consumer Discretionary,Restaurants
KRYS,Krystal Biotech Inc. Common Stock,$143.335,3.595,2.573%,4142192298.00,United States,2017,246977,Health Care,Biotechnology: Biological Products (No Diagnostic Substances)
KSCP,Knightscope Inc. Class A Common Stock,$6.66,-0.15,-2.203%,45962159.00,United States,2022,862493,Telecommunications,Telecommunications Equipment
KSPI,Joint Stock Company Kaspi.kz American Depository Shares,$83.58,1.08,1.309%,15824491005.00,Kazakhstan,2024,488186,,
KSS,Kohl's Corporation Common Stock,$9.08,0.06,0.665%,1017338445.00,United States,1992,7036133,Consumer Discretionary,Department/Specialty Retail Stores
KT,KT Corporation Common Stock,$20.77,-0.24,-1.142%,10211900577.00,South Korea,,1690494,Telecommunications,Telecommunications Equipment
KTB,Kontoor Brands Inc. Common Stock ,$70.93,0.04,0.056%,3940968045.00,United States,2019,670446,Consumer Discretionary,Apparel
KTCC,Key Tronic Corporation Common Stock,$2.96,0.03,1.024%,31855138.00,United States,1983,20126,Technology,Electrical Products
KTF,DWS Municipal Income Trust,$8.82,-0.02,-0.226%,348398273.00,United States,1988,66512,Finance,Finance Companies
KTH,Structures Products Cp 8% CorTS Issued by Peco Energy Cap Tr II Preferred Stock,$28.555,0.055,0.193%,0.00,United States,,140,Finance,Finance: Consumer Services
KTN,Structured Products Corp 8.205% CorTS 8.205% Corporate Backed Trust Securities (CorTS),$26.05,0.00,0.00%,0.00,United States,,1494,Finance,Finance: Consumer Services
KTOS,Kratos Defense & Security Solutions Inc. Common Stock,$44.34,-0.44,-0.983%,6803677784.00,United States,,3614653,Industrials,Military/Government/Technical
KTTA,Pasithea Therapeutics Corp. Common Stock,$0.721,0.0044,0.614%,5366819.00,United States,2021,89164,Health Care,Biotechnology: Pharmaceutical Preparations
KTTAW,Pasithea Therapeutics Corp. Warrant,$0.021,0.006,40.00%,156315.00,United States,2021,1000,Health Care,Biotechnology: Pharmaceutical Preparations
KUKE,Kuke Music Holding Limited American Depositary Shares (each representing ten (10) Class A Ordinary Shares),$3.07,0.10,3.367%,62395586.00,,,33097,Real Estate,Other Consumer Services
KULR,KULR Technology Group Inc. Common Stock,$6.84,0.40,6.211%,264015450.00,United States,,5667499,Technology,Electrical Products
KURA,Kura Oncology Inc. Common Stock,$5.81,0.13,2.289%,502998931.00,United States,,965709,Health Care,Biotechnology: Pharmaceutical Preparations
KVAC,Keen Vision Acquisition Corporation Ordinary Shares,$11.42,0.00,0.00%,0.00,United States,2023,4,,
KVACU,Keen Vision Acquisition Corporation Units,$11.44,0.13,1.149%,0.00,United States,2023,695,,
KVACW,Keen Vision Acquisition Corporation Warrant,$0.055,-0.0049,-8.18%,0.00,United States,2023,18000,,
KVHI,KVH Industries Inc. Common Stock,$5.40,0.02,0.372%,105837089.00,United States,1996,35297,Technology,Radio And Television Broadcasting And Communications Equipment
KVUE,Kenvue Inc. Common Stock,$20.70,-0.20,-0.957%,39742135717.00,United States,2023,16971366,Consumer Discretionary,Specialty Chemicals
KVYO,Klaviyo Inc. Series A Common Stock,$33.96,0.10,0.295%,10085663374.00,United States,2023,987677,Technology,Computer Software: Prepackaged Software
KW,Kennedy-Wilson Holdings Inc. Common Stock,$7.40,0.17,2.351%,1023370331.00,United States,,1468922,Finance,Real Estate
KWM,K Wave Media Ltd. Ordinary Shares,$5.20,0.23,4.628%,328442400.00,Cayman Islands,,484843,Consumer Discretionary,Movies/Entertainment
KWMWW,K Wave Media Ltd. Warrant,$0.21,0.0322,18.11%,13264020.00,Cayman Islands,,132504,Consumer Discretionary,Movies/Entertainment
KWR,Quaker Houghton Common Stock,$126.07,2.86,2.321%,2229000176.00,United States,,251369,Industrials,Major Chemicals
KXIN,Kaixin Holdings Ordinary Shares,$0.9399,-0.0101,-1.063%,10295030.00,China,2017,150771,Consumer Discretionary,Retail-Auto Dealers and Gas Stations
KYMR,Kymera Therapeutics Inc. Common Stock,$43.43,-0.38,-0.867%,2828142838.00,United States,2020,647695,Health Care,Biotechnology: Biological Products (No Diagnostic Substances)
KYN,Kayne Anderson Energy Infrastructure Fund Inc.,$12.45,0.06,0.484%,1694837549.00,United States,2004,230327,Finance,Finance/Investors Services
KYTX,Kyverna Therapeutics Inc. Common Stock,$2.82,0.27,10.588%,121877222.00,United States,2024,374696,Health Care,Biotechnology: Biological Products (No Diagnostic Substances)
KZIA,Kazia Therapeutics Limited American Depositary Shares,$6.825,0.275,4.198%,9279441.00,Australia,,321623,Health Care,Biotechnology: Pharmaceutical Preparations
KZR,Kezar Life Sciences Inc. Common Stock,$4.53,-0.02,-0.44%,33095274.00,United States,2018,27501,Health Care,Biotechnology: Pharmaceutical Preparations
L,Loews Corporation Common Stock,$91.67,0.22,0.241%,19222880722.00,United States,,857822,Finance,Property-Casualty Insurers
LAB,Standard BioTools Inc. Common Stock,$1.30,0.02,1.563%,493768948.00,United States,2011,1628964,Industrials,Biotechnology: Laboratory Analytical Instruments
LAC,Lithium Americas Corp. Common Shares,$2.74,0.13,4.981%,599200906.00,Canada,2023,7656232,Basic Materials,Metal Mining
LAD,Lithia Motors Inc. Common Stock,$345.60,-0.62,-0.179%,8996165683.00,United States,,213716,Consumer Discretionary,Retail-Auto Dealers and Gas Stations
LADR,Ladder Capital Corp Class A Common Stock,$11.02,0.11,1.008%,1411623055.00,United States,2014,458641,Real Estate,Real Estate Investment Trusts
LAES,SEALSQ Corp Ordinary Shares,$3.97,0.06,1.535%,414900337.00,Switzerland,,11774264,Technology,Semiconductors
LAKE,Lakeland Industries Inc. Common Stock,$14.56,0.26,1.818%,138532561.00,United States,1986,229115,Health Care,Industrial Specialties
LAMR,Lamar Advertising Company Class A Common Stock,$123.58,1.50,1.229%,12653361143.00,United States,1996,584395,Real Estate,Real Estate Investment Trusts
LAND,Gladstone Land Corporation Common Stock,$10.40,0.02,0.193%,376320443.00,United States,1993,441252,Real Estate,Real Estate Investment Trusts
LANDM,Gladstone Land Corporation 5.00% Series D Cumulative Term Preferred Stock,$24.73,-0.005,-0.02%,894846592.00,United States,,4913,Real Estate,Real Estate Investment Trusts
LANDO,Gladstone Land Corporation 6.00% Series B Cumulative Redeemable Preferred Stock,$19.53,0.12,0.618%,706686371.00,United States,,12213,Real Estate,Real Estate Investment Trusts
LANDP,Gladstone Land Corporation 6.00% Series C Cumulative Redeemable Preferred Stock,$19.65,0.18,0.924%,711028530.00,United States,,21721,Real Estate,Real Estate Investment Trusts
LANV,Lanvin Group Holdings Limited Ordinary Shares,$2.40,0.12,5.263%,335461930.00,Cayman Islands,2022,30930,Consumer Discretionary,Apparel
LAR,Lithium Argentina AG Common Shares,$2.34,0.09,4.00%,378846000.00,Canada,2023,1983298,Basic Materials,Metal Mining
LARK,Landmark Bancorp Inc. Common Stock,$27.44,0.24,0.882%,158687688.00,United States,,15888,Finance,Major Banks
LASE,Laser Photonics Corporation Common Stock,$2.90,0.51,21.339%,41400835.00,United States,2022,2287135,Miscellaneous,Industrial Machinery/Components
LASR,nLIGHT Inc. Common Stock,$18.93,-0.04,-0.211%,935889186.00,United States,2018,831957,Technology,Semiconductors
LAUR,Laureate Education Inc. Common Stock,$24.22,0.23,0.959%,3604182148.00,United States,2017,1983034,Real Estate,Other Consumer Services
LAW,CS Disco Inc. Common Stock,$4.42,0.00,0.00%,268767174.00,United States,2021,144941,Technology,Computer Software: Prepackaged Software
LAZ,Lazard Inc. Common Stock,$50.06,0.26,0.522%,5645070515.00,Bermuda,2005,1054464,Finance,Investment Managers
LAZR,Luminar Technologies Inc.  Class A Common Stock,$3.02,0.15,5.226%,141574045.00,United States,2019,3732985,Consumer Discretionary,Auto Parts:O.E.M.
LB,LandBridge Company LLC Class A Shares Representing Limited Liability Company Interests,$63.40,-0.90,-1.40%,4843564411.00,,2024,351492,Energy,Oil & Gas Production
LBGJ,Li Bang International Corporation Inc. Ordinary Shares,$1.25,0.00,0.00%,23150000.00,China,2024,9568,,
LBRDA,Liberty Broadband Corporation Class A Common Stock,$99.04,1.27,1.299%,14195452225.00,United States,,111348,Telecommunications,Cable & Other Pay Television Services
LBRDK,Liberty Broadband Corporation Class C Common Stock,$99.51,1.18,1.20%,14262817557.00,United States,,1655057,Telecommunications,Cable & Other Pay Television Services
LBRDP,Liberty Broadband Corporation Series A Cumulative Redeemable Preferred Stock,$25.06,0.01,0.04%,3591862205.00,United States,,2742,Telecommunications,Cable & Other Pay Television Services
LBRT,Liberty Energy Inc. Class A common stock,$12.70,0.83,6.992%,2056818518.00,United States,2018,3060196,Energy,Oilfield Services/Equipment
LBTYA,Liberty Global Ltd. Class A Common Shares,$10.03,0.10,1.007%,3466154251.00,United Kingdom,,1643679,Telecommunications,Cable & Other Pay Television Services
LBTYB,Liberty Global Ltd. Class B Common Shares,$9.57,0.00,0.00%,3307188054.00,United Kingdom,,216,Telecommunications,Cable & Other Pay Television Services
LBTYK,Liberty Global Ltd. Class C Common Shares,$10.28,0.06,0.587%,3552548923.00,United Kingdom,,781448,Telecommunications,Cable & Other Pay Television Services
LC,LendingClub Corporation Common Stock,$12.40,0.15,1.224%,1416077917.00,United States,2014,1166575,Finance,Finance: Consumer Services
LCCC,Lakeshore Acquisition III Corp. Ordinary Shares,$10.025,0.00,0.00%,0.00,United States,2025,57,Finance,Blank Checks
LCCCR,Lakeshore Acquisition III Corp. Rights,$0.20,0.00,0.00%,0.00,United States,2025,22658,Finance,Blank Checks
LCCCU,Lakeshore Acquisition III Corp. Unit,$10.33,0.15,1.473%,0.00,United States,2025,200,Finance,Blank Checks
LCFY,Locafy Limited Ordinary Share,$4.81,0.53,12.383%,6648310.00,Australia,2022,260484,Technology,Computer Software: Programming Data Processing
LCFYW,Locafy Limited Warrant,$9.00,0.00,0.00%,12439665.00,Australia,2022,279,Technology,Computer Software: Programming Data Processing
LCID,Lucid Group Inc. Common Stock,$2.30,0.19,9.005%,7015602681.00,United States,,215696671,Consumer Discretionary,Auto Manufacturing
LCII,LCI Industries,$98.61,2.36,2.452%,2488685554.00,United States,1995,293950,Consumer Discretionary,Auto Parts:O.E.M.
LCNB,LCNB Corporation Common Stock,$14.99,0.07,0.469%,212369746.00,United States,,47435,Finance,Major Banks
LCTX,Lineage Cell Therapeutics Inc. Common Stock,$0.9849,0.0345,3.63%,224908110.00,United States,,957119,Health Care,Biotechnology: Biological Products (No Diagnostic Substances)
LCUT,Lifetime Brands Inc. Common Stock,$5.37,0.20,3.868%,120363207.00,United States,1991,59444,Consumer Discretionary,Industrial Machinery/Components
LDI,loanDepot Inc. Class A Common Stock,$1.39,0.09,6.923%,458575642.00,United States,2021,1164307,Finance,Finance: Consumer Services
LDOS,Leidos Holdings Inc. Common Stock,$162.09,-2.37,-1.441%,20864041962.00,United States,,1053274,Technology,EDP Services
LDP,Cohen & Steers Limited Duration Preferred and Income Fund Inc.,$21.16,0.02,0.095%,0.00,United States,2012,55892,Finance,Finance Companies
LDWY,Lendway Inc. Common Stock (DE),$4.99,0.01,0.201%,8830299.00,United States,,851,Consumer Staples,Farming/Seeds/Milling
LE,Lands' End Inc. Common Stock,$11.36,-0.10,-0.873%,346169997.00,United States,,219287,Consumer Discretionary,Clothing/Shoe/Accessory Stores
LEA,Lear Corporation Common Stock,$106.00,3.30,3.213%,5667130152.00,United States,,1290617,Consumer Discretionary,Auto Parts:O.E.M.
LECO,Lincoln Electric Holdings Inc. Common Shares,$219.33,1.615,0.742%,12244378870.00,United States,,540942,Industrials,Industrial Machinery/Components
LEDS,SemiLEDS Corporation Common Stock,$2.785,0.105,3.918%,22839693.00,Taiwan,2010,54269,Technology,Semiconductors
LEE,Lee Enterprises Incorporated Common Stock,$6.30,-0.26,-3.963%,39186403.00,United States,,8463,Consumer Discretionary,Newspapers/Magazines
LEG,Leggett & Platt Incorporated Common Stock,$9.92,0.35,3.657%,1340633579.00,United States,,3327187,Consumer Discretionary,Home Furnishings
LEGH,Legacy Housing Corporation Common Stock (TX),$23.30,-0.14,-0.597%,561946977.00,United States,2018,71371,Consumer Discretionary,Homebuilding
LEGN,Legend Biotech Corporation American Depositary Shares,$37.49,1.62,4.516%,6885006933.00,United States,2020,1893332,Health Care,Biotechnology: Pharmaceutical Preparations
LEGT,Legato Merger Corp. III Ordinary Shares,$10.68,-0.04,-0.373%,0.00,,2024,5356,,
LEN,Lennar Corporation Class A Common Stock,$110.42,1.20,1.099%,28599534500.00,United States,,3037224,Consumer Discretionary,Homebuilding
LENZ,LENZ Therapeutics Inc. Common Stock,$31.36,-0.12,-0.381%,882663389.00,United States,2021,127378,Health Care,Biotechnology: Biological Products (No Diagnostic Substances)
LEO,BNY Mellon Strategic Municipals Inc. Common Stock,$5.96,0.04,0.676%,371253490.00,United States,1987,118414,Finance,Trusts Except Educational Religious and Charitable
LESL,Leslie's Inc. Common Stock,$0.4729,0.0041,0.875%,87685902.00,United States,2020,3567571,Consumer Discretionary,Other Specialty Stores
