Symbol,Name,Last Sale,Net Change,% Change,Market Cap,Country,IPO Year,Volume,Sector,Industry
PTEN,Patterson-UTI Energy Inc. Common Stock,$6.60,0.43,6.969%,2547514372.00,United States,1993,11796955,Energy,Oil & Gas Production
PTGX,Protagonist Therapeutics Inc. Common Stock,$49.70,-0.17,-0.341%,3080503164.00,United States,2016,591635,Health Care,Biotechnology: Pharmaceutical Preparations
PTHL,Pheton Holdings Ltd Class A Ordinary Shares,$19.40,-0.15,-0.767%,276450000.00,China,2024,944968,Health Care,Biotechnology: Electromedical & Electrotherapeutic Apparatus
PTHS,Pelthos Therapeutics Inc. Common Stock,$19.88,-6.07,-23.391%,13112550.00,,2024,201767,Health Care,Biotechnology: Biological Products (No Diagnostic Substances)
PTIX,Protagenic Therapeutics Inc. Common Stock,$3.43,0.04,1.18%,2020143.00,United States,,240618,Health Care,Biotechnology: Pharmaceutical Preparations
PTIXW,Protagenic Therapeutics Inc. Warrant,$0.0558,-0.0014,-2.448%,32864.00,United States,,3199,Health Care,Biotechnology: Pharmaceutical Preparations
PTLE,PTL LTD Class A Ordinary Shares,$0.2355,-0.0091,-3.72%,8828306.00,Singapore,2024,788720,Energy,Oil Refining/Marketing
PTLO,Portillo's Inc. Class A Common Stock,$11.95,0.03,0.252%,894043182.00,United States,2021,2584871,Consumer Discretionary,Restaurants
PTMN,Portman Ridge Finance Corporation Common Stock,$12.55,0.09,0.722%,115496019.00,United States,2006,24519,Finance,Finance: Consumer Services
PTNM,Pitanium Limited Class A Ordinary shares,$9.04,0.29,3.314%,205660000.00,Hong Kong,2025,1950614,Consumer Discretionary,Package Goods/Cosmetics
PTON,Peloton Interactive Inc. Class A Common Stock,$6.71,0.28,4.355%,2674334815.00,United States,2019,9236788,Consumer Discretionary,Recreational Games/Products/Toys
PTY,Pimco Corporate & Income Opportunity Fund,$13.90,0.00,0.00%,0.00,United States,2002,510737,Finance,Investment Managers
PUBM,PubMatic Inc. Class A Common Stock,$12.55,0.11,0.884%,609097295.00,United States,2020,375403,Technology,Computer Software: Programming Data Processing
PUK,Prudential Public Limited Company Common Stock,$25.12,0.85,3.502%,32585255197.00,United Kingdom,,1848446,Finance,Life Insurance
PULM,Pulmatrix Inc. Common Stock,$6.56,-0.10,-1.502%,23958990.00,United States,2014,10616,Health Care,Biotechnology: Pharmaceutical Preparations
PUMP,ProPetro Holding Corp. Common Stock,$6.64,0.47,7.618%,689961152.00,United States,2017,1880269,Energy,Oilfield Services/Equipment
PVBC,Provident Bancorp Inc. (MD) Common Stock,$12.78,0.11,0.868%,227331126.00,United States,2015,138306,Finance,Banks
PVH,PVH Corp. Common Stock,$73.85,0.83,1.137%,3550199912.00,United States,,1226131,Consumer Discretionary,Apparel
PVL,Permianville Royalty Trust Trust Units ,$1.82,0.00,0.00%,60060000.00,United States,2011,25658,Energy,Oil & Gas Production
PVLA,Palvella Therapeutics Inc. Common Stock,$24.89,-0.01,-0.04%,275175502.00,United States,,46559,Health Care,Biotechnology: Pharmaceutical Preparations
PW,Power REIT (MD) Common Stock,$1.12,0.00,0.00%,3796420.00,United States,1998,8273,Real Estate,Real Estate Investment Trusts
PW^A,Power REIT 7.75% Series A Cumulative Perpetual Preferred Stock,$4.15,0.00,0.00%,,United States,,5,,
PWM,Prestige Wealth Inc. Class A Ordinary Shares,$0.4098,0.009,2.246%,12966875.00,Hong Kong,2023,368812,Finance,Finance: Consumer Services
PWOD,Penns Woods Bancorp Inc. Common Stock,$32.07,0.25,0.786%,244187843.00,United States,,21541,Finance,Major Banks
PWP,Perella Weinberg Partners Class A Common Stock,$20.31,0.10,0.495%,1795062203.00,United States,2020,853444,Finance,Finance: Consumer Services
PWR,Quanta Services Inc. Common Stock,$377.56,-8.24,-2.136%,55953906835.00,United States,,1154615,Industrials,Engineering & Construction
PX,P10 Inc. Class A Common Stock,$10.72,0.23,2.193%,1201974383.00,United States,2021,1054029,Finance,Investment Managers
PXLW,Pixelworks Inc.  Common Stock,$7.37,0.36,5.136%,38663381.00,United States,2000,22580,Technology,Semiconductors
PXS,Pyxis Tankers Inc. Common Stock,$2.91,0.08,2.827%,30513867.00,Greece,,18156,Consumer Discretionary,Marine Transportation
PYN,PIMCO New York Municipal Income Fund III Common Shares of Beneficial Interest,$5.305,0.035,0.664%,0.00,United States,2002,15321,Finance,Investment Managers
PYPD,PolyPid Ltd. Ordinary Shares,$3.43,-0.02,-0.58%,34954801.00,Israel,2020,113779,Health Care,Biotechnology: Pharmaceutical Preparations
PYPL,PayPal Holdings Inc. Common Stock,$75.03,-1.15,-1.51%,72969138160.00,United States,,8753420,Consumer Discretionary,Business Services
PYT,PPlus Tr GSC-2 Tr Ctf Fltg Rate,$23.14,0.1755,0.764%,0.00,United States,,700,Finance,Finance: Consumer Services
PYXS,Pyxis Oncology Inc. Common Stock,$1.13,-0.01,-0.877%,70000861.00,United States,2021,190475,Health Care,Biotechnology: Pharmaceutical Preparations
PZC,PIMCO California Municipal Income Fund III Common Shares of Beneficial Interest,$6.23,-0.04,-0.638%,0.00,United States,2002,22058,Finance,Investment Managers
PZG,Paramount Gold Nevada Corp. Common Stock,$0.711,0.0239,3.478%,50800346.00,United States,2015,526517,Basic Materials,Metal Mining
PZZA,Papa John's International Inc. Common Stock,$48.31,0.76,1.598%,1581593795.00,United States,1993,981867,Consumer Discretionary,Restaurants
QBTS,D-Wave Quantum Inc. Common Shares,$15.99,-0.77,-4.594%,4672138263.00,,2022,37259661,Technology,EDP Services
QCOM,QUALCOMM Incorporated Common Stock,$159.45,1.36,0.86%,175076100000.00,United States,1991,6875238,Technology,Radio And Television Broadcasting And Communications Equipment
QCRH,QCR Holdings Inc. Common Stock,$72.79,0.66,0.915%,1232437916.00,United States,,133411,Finance,Major Banks
QD,Qudian Inc. American Depositary Shares each representing one Class A Ordinary Share,$3.23,-0.07,-2.121%,533358569.00,China,2017,696007,Finance,Finance: Consumer Services
QDEL,QuidelOrtho Corporation Common Stock,$30.82,1.60,5.476%,2084229375.00,United States,,1524697,Health Care,Biotechnology: In Vitro & In Vivo Diagnostic Substances
QETA,Quetta Acquisition Corporation Common Stock,$11.00,0.07,0.64%,0.00,United States,2023,4434,Finance,Blank Checks
QETAR,Quetta Acquisition Corporation Right,$1.54,0.08,5.479%,0.00,United States,2023,1403,Finance,Blank Checks
QFIN,Qifu Technology Inc. American Depositary Shares,$44.40,0.93,2.139%,6229975522.00,China,2018,1527295,Finance,Finance: Consumer Services
QGEN,Qiagen N.V. Common Shares,$47.85,0.32,0.673%,10341155481.00,Netherlands,,1755876,Health Care,Biotechnology: Biological Products (No Diagnostic Substances)
QH,Quhuo Limited American Depository Shares,$1.25,0.005,0.402%,112118768.00,China,2020,59776,Consumer Discretionary,Business Services
QIPT,Quipt Home Medical Corp. Common Shares,$1.80,0.07,4.046%,78199150.00,United States,,299815,Health Care,Misc Health and Biotechnology Services
QLGN,Qualigen Therapeutics Inc. Common Stock,$3.43,0.04,1.18%,5609679.00,United States,2015,8518,Health Care,Biotechnology: Pharmaceutical Preparations
QLYS,Qualys Inc. Common Stock,$147.78,0.84,0.572%,5368274900.00,United States,2012,332819,Technology,Computer Software: Prepackaged Software
QMCO,Quantum Corporation Common Stock,$9.07,0.16,1.796%,52916185.00,United States,,692432,Technology,Electronic Components
QMMM,QMMM Holdings Limited Class A Ordinary Shares,$1.73,0.25,16.892%,29766972.00,Hong Kong,2024,6382959,Consumer Discretionary,Advertising
QNCX,Quince Therapeutics Inc. Common Stock,$1.61,-0.02,-1.227%,73204739.00,United States,2019,212332,Health Care,Biotechnology: Biological Products (No Diagnostic Substances)
QNRX,Quoin Pharmaceuticals Ltd. American Depositary Shares,$8.73,-0.15,-1.689%,5134689.00,Israel,2016,1937,Health Care,Medical/Dental Instruments
QNST,QuinStreet Inc. Common Stock,$16.19,0.19,1.188%,922051666.00,United States,2010,329802,Consumer Discretionary,Business Services
QNTM,Quantum Biopharma Ltd. Class B Subordinate Voting Shares,$17.41,0.85,5.133%,51033045.00,Canada,,267250,Health Care,Biotechnology: Pharmaceutical Preparations
QQQX,Nuveen NASDAQ 100 Dynamic Overwrite Fund Shares of Beneficial Interest,$26.16,-0.06,-0.229%,0.00,United States,,135249,Finance,Finance Companies
QRHC,Quest Resource Holding Corporation Common Stock,$2.03,-0.04,-1.932%,41892211.00,United States,,57643,Utilities,Environmental Services
QRVO,Qorvo Inc. Common Stock,$88.03,0.99,1.137%,8189006507.00,United States,,2619117,Technology,Semiconductors
QS,QuantumScape Corporation Class A Common Stock,$8.18,1.17,16.69%,4572016995.00,United States,2020,73059548,Miscellaneous,Industrial Machinery/Components
QSEA,Quartzsea Acquisition Corporation Ordinary Shares,$10.065,0.00,0.00%,0.00,United States,2025,68505,Finance,Blank Checks
QSEAU,Quartzsea Acquisition Corporation Units,$10.30,0.00,0.00%,0.00,United States,2025,216,Finance,Blank Checks
QSG,QuantaSing Group Limited American Depositary Shares,$9.02,0.07,0.782%,461039287.00,China,2023,735797,Real Estate,Other Consumer Services
QSI,Quantum-Si Incorporated Class A Common Stock,$1.81,-0.015,-0.822%,332131590.00,United States,2020,9972018,Industrials,Industrial Machinery/Components
QSIAW,Quantum-Si Incorporated Warrant,$0.63,-0.0325,-4.906%,115603813.00,United States,2020,3605,Industrials,Industrial Machinery/Components
QSR,Restaurant Brands International Inc. Common Shares,$68.20,0.34,0.501%,31005521435.00,Canada,2014,1965448,Consumer Discretionary,Restaurants
QTRX,Quanterix Corporation Common Stock,$6.54,0.24,3.81%,253944184.00,United States,2017,603792,Industrials,Biotechnology: Laboratory Analytical Instruments
QTTB,Q32 Bio Inc. Common Stock,$1.39,0.03,2.206%,16954685.00,United States,2018,105510,Health Care,Biotechnology: Pharmaceutical Preparations
QTWO,Q2 Holdings Inc. Common Stock,$93.80,0.47,0.504%,5844100473.00,United States,2014,497997,Technology,Computer Software: Prepackaged Software
QUAD,Quad Graphics Inc Class A Common Stock,$5.62,0.00,0.00%,284442267.00,United States,,128678,Consumer Discretionary,Publishing
QUBT,Quantum Computing Inc. Common Stock,$19.35,-0.53,-2.666%,2726483422.00,United States,,15692970,Technology,Computer Software: Prepackaged Software
QUIK,QuickLogic Corporation Common Stock,$6.19,-0.02,-0.322%,98025205.00,United States,1999,92467,Technology,Semiconductors
QURE,uniQure N.V. Ordinary Shares,$14.44,0.13,0.908%,790568282.00,Netherlands,2014,704160,Health Care,Biotechnology: Pharmaceutical Preparations
QVCC,QVC Inc. 6.250% Senior Secured Notes due 2068,$10.21,-0.0899,-0.873%,0.00,United States,2019,31053,Consumer Discretionary,Catalog/Specialty Distribution
QVCD,QVC Inc. 6.375% Senior Secured Notes due 2067,$9.97,-0.07,-0.697%,0.00,United States,2018,7681,Consumer Discretionary,Catalog/Specialty Distribution
QVCGA,QVC Group Inc. Series A Common Stock,$2.90,0.07,2.473%,23399317.00,United States,,77210,Consumer Discretionary,Catalog/Specialty Distribution
QVCGP,QVC Group Inc. 8.0% Fixed Rate Cumulative Redeemable Preferred Stock,$6.68,-0.42,-5.915%,53899116.00,United States,,48742,Consumer Discretionary,Catalog/Specialty Distribution
QXO,QXO Inc. Common Stock,$21.65,-0.03,-0.138%,12519448205.00,United States,,5276538,Consumer Discretionary,RETAIL: Building Materials
QXO^B,QXO Inc.  Depositary Shares each representing a 1/20th interest in a share of 5.50% Series B Mandatory Convertible Preferred Stock,$61.99,-0.11,-0.177%,,United States,,6007,,
R,Ryder System Inc. Common Stock,$170.20,0.94,0.555%,7036202798.00,United States,,385798,Consumer Discretionary,Rental/Leasing Companies
RA,Brookfield Real Assets Income Fund Inc. Common Stock,$13.41,-0.04,-0.297%,0.00,United States,2016,164163,Finance,Investment Managers
RAAQ,Real Asset Acquisition Corp. Class A Ordinary Share,$10.16,0.02,0.197%,0.00,United States,2025,41925,,
RAAQU,Real Asset Acquisition Corp. Unit,$10.36,0.00,0.00%,0.00,United States,2025,19,Finance,Blank Checks
RAAQW,Real Asset Acquisition Corp. Warrants,$0.38,0.00,0.00%,0.00,United States,2025,1800,,
RAC,Rithm Acquisition Corp. Class A Ordinary Shares,$10.18,0.00,0.00%,0.00,,2025,53447,,
RAC/WS,Rithm Acquisition Corp.,$0.45,0.00,0.00%,,,,3500,,
RACE,Ferrari N.V. Common Shares,$489.03,2.71,0.557%,118529724072.00,Italy,2015,365434,Consumer Discretionary,Auto Manufacturing
RADX,Radiopharm Theranostics Limited American Depositary Shares,$4.05,0.21,5.469%,8800491062.00,Australia,,8660,,
RAIL,FreightCar America Inc. Common Stock,$9.83,-0.08,-0.807%,187166247.00,United States,2005,176987,Industrials,Railroads
RAIN,Rain Enhancement Technologies Holdco Inc. Class A Common Stock,$3.36,0.084,2.564%,25490684.00,United States,,16029,Technology,Industrial Machinery/Components
RAINW,Rain Enhancement Technologies Holdco Inc. Warrants,$0.1175,0.02,20.513%,891415.00,United States,,3036,Technology,Industrial Machinery/Components
RAL,Ralliant Corporation Common Stock,$48.00,1.82,3.941%,5423533248.00,,2025,4671699,Industrials,Industrial Machinery/Components
RAMP,LiveRamp Holdings Inc. Common Stock,$33.31,-0.01,-0.03%,2164876358.00,United States,2018,395597,Technology,EDP Services
RAND,Rand Capital Corporation Common Stock,$16.525,0.225,1.38%,49076176.00,United States,,1688,Finance,Finance: Consumer Services
RANG,Range Capital Acquisition Corp. Ordinary Shares,$10.24,0.03,0.294%,0.00,United States,2025,2814,,
RANGR,Range Capital Acquisition Corp. Rights,$0.2197,-0.0303,-12.12%,0.00,United States,2025,15304,,
RANGU,Range Capital Acquisition Corp. Units,$10.70,0.00,0.00%,0.00,United States,2024,2,,
RANI,Rani Therapeutics Holdings Inc. Class A Common Stock,$0.6014,0.0651,12.139%,34605822.00,United States,2021,712512,Health Care,Biotechnology: Pharmaceutical Preparations
RAPP,Rapport Therapeutics Inc. Common Stock,$12.62,0.58,4.817%,460599144.00,United States,2024,143261,Health Care,Biotechnology: Pharmaceutical Preparations
RAPT,RAPT Therapeutics Inc. Common Stock,$8.03,-0.13,-1.593%,132784771.00,United States,2019,38101,Health Care,Biotechnology: Pharmaceutical Preparations
RARE,Ultragenyx Pharmaceutical Inc. Common Stock,$39.42,-0.19,-0.48%,3726847020.00,United States,2014,1205385,Health Care,Biotechnology: Pharmaceutical Preparations
RAVE,Rave Restaurant Group Inc. Common Stock,$2.82,-0.01,-0.353%,40076616.00,United States,,13242,Consumer Discretionary,Food Distributors
RAY,Raytech Holding Limited Ordinary Shares,$1.37,0.04,3.008%,24129924.00,Hong Kong,2024,1017526,Consumer Discretionary,Consumer Electronics/Appliances
RAYA,Erayak Power Solution Group Inc. Class A Ordinary Shares,$2.45,-0.54,-18.06%,123941176.00,China,2022,545643,Consumer Discretionary,Metal Fabrications
RBA,RB Global Inc. Common Stock,$104.70,-0.89,-0.843%,19511156378.00,Canada,,938636,Consumer Discretionary,Business Services
RBB,RBB Bancorp Common Stock,$18.70,0.39,2.13%,331735363.00,United States,2017,95932,Finance,Major Banks
RBBN,Ribbon Communications Inc. Common Stock,$4.05,-0.03,-0.735%,715004763.00,United States,,305552,Technology,EDP Services
RBC,RBC Bearings Incorporated Common Stock,$381.60,-5.38,-1.39%,12012026933.00,United States,2022,171906,Industrials,Metal Fabrications
RBCAA,Republic Bancorp Inc. Class A Common Stock,$75.55,0.03,0.04%,1475100529.00,United States,1998,60758,Finance,Major Banks
RBKB,Rhinebeck Bancorp Inc. Common Stock,$11.83,-0.07,-0.588%,131294119.00,United States,2019,33052,Finance,Banks
RBLX,Roblox Corporation Class A Common Stock,$104.94,-2.82,-2.617%,71179156121.00,United States,2021,5958929,Technology,Computer Software: Prepackaged Software
RBNE,Robin Energy Ltd. Common Stock,$2.73,-0.06,-2.151%,6515778.00,Cyprus,,557737,Consumer Discretionary,Marine Transportation
RBOT,Vicarious Surgical Inc. Class A Common Stock,$7.72,0.00,0.00%,45794916.00,Hong Kong,2020,15430,Health Care,Industrial Specialties
RBRK,Rubrik Inc. Class A Common Stock,$86.87,-2.98,-3.317%,16808767315.00,United States,2024,3968086,Technology,Computer Software: Prepackaged Software
RC,Ready Capital Corporation Common Stock,$4.62,0.07,1.538%,787743389.00,United States,2013,1585233,Real Estate,Real Estate Investment Trusts
RC^C,Ready Capital Corporation 6.25% Series C Cumulative Convertible Preferred Stock,$15.145,-0.3552,-2.292%,,United States,,572,,
RC^E,Ready Capital Corporation 6.50% Series E Cumulative Redeemable Preferred Stock,$15.21,-0.02,-0.131%,,United States,,6575,,
RCAT,Red Cat Holdings Inc. Common Stock,$6.90,0.11,1.62%,627315329.00,United States,,3742148,Technology,Computer Software: Prepackaged Software
RCB,Ready Capital Corporation 6.20% Senior Notes due 2026,$24.37,-0.04,-0.164%,4155261122.00,United States,2019,3730,Real Estate,Real Estate Investment Trusts
RCC,Ready Capital Corporation 5.75% Senior Notes due 2026,$24.66,-0.02,-0.081%,4204708218.00,United States,2021,5208,Real Estate,Real Estate Investment Trusts
RCD,Ready Capital Corporation 9.00% Senior Notes due 2029,$23.19,0.21,0.914%,0.00,United States,2024,19185,Real Estate,Real Estate Investment Trusts
RCEL,Avita Medical Inc. Common Stock,$5.61,0.44,8.511%,148298431.00,United States,,347946,Health Care,Medical/Dental Instruments
RCG,RENN Fund Inc Common Stock,$2.6991,0.0491,1.853%,0.00,United States,,23228,Finance,Investment Managers
RCI,Rogers Communication Inc. Common Stock,$32.25,0.40,1.256%,17236581551.00,Canada,,2100468,Telecommunications,Cable & Other Pay Television Services
RCKT,Rocket Pharmaceuticals Inc. Common Stock,$2.96,0.15,5.338%,318904240.00,United States,2015,2191184,Health Care,Biotechnology: Pharmaceutical Preparations
RCKTW,Rocket Pharmaceuticals Inc. Warrant,$0.043,-0.006,-12.245%,4632731.00,United States,,3220,Health Care,Biotechnology: Pharmaceutical Preparations
RCKY,Rocky Brands Inc. Common Stock,$23.87,0.72,3.11%,178098056.00,United States,1993,144567,Consumer Discretionary,Shoe Manufacturing
RCL,Royal Caribbean Cruises Ltd. Common Stock,$330.20,1.35,0.411%,89669234834.00,United States,1993,2328424,Consumer Discretionary,Marine Transportation
RCMT,RCM Technologies Inc. Common Stock,$26.64,-0.36,-1.333%,196879856.00,United States,,71229,Consumer Discretionary,Professional Services
RCON,Recon Technology Ltd. Class A Ordinary Shares,$2.32,-0.13,-5.306%,35004065.00,China,2009,44842,Energy,Oilfield Services/Equipment
RCS,PIMCO Strategic Income Fund Inc.,$7.02,-0.03,-0.426%,0.00,United States,1994,102453,Finance,Investment Managers
RCT,RedCloud Holdings plc Ordinary Shares,$1.92,-0.10,-4.95%,84915139.00,United Kingdom,2025,306132,Consumer Discretionary,Other Specialty Stores
RCUS,Arcus Biosciences Inc. Common Stock,$8.50,0.28,3.406%,900023673.00,United States,2018,1432037,Health Care,Biotechnology: Pharmaceutical Preparations
RDAC,Rising Dragon Acquisition Corp. Ordinary Shares,$10.29,0.00,0.00%,0.00,China,2024,216,,
RDAG,Republic Digital Acquisition Company Class A Ordinary Shares,$10.25,-0.04,-0.389%,0.00,United States,2025,1032,Finance,Blank Checks
RDAGU,Republic Digital Acquisition Company Unit,$10.65,0.07,0.662%,0.00,United States,2025,2140,Finance,Blank Checks
RDAGW,Republic Digital Acquisition Company Warrants,$0.699,-0.0151,-2.115%,0.00,United States,2025,1365,Finance,Blank Checks
RDCM,Radcom Ltd. Ordinary Shares,$13.27,-0.32,-2.355%,211200224.00,Israel,1997,10356,Technology,Computer peripheral equipment
RDDT,Reddit Inc. Class A Common Stock,$145.96,-7.41,-4.831%,26932628528.00,United States,2024,7046569,Technology,EDP Services
RDGT,Ridgetech Inc. Ordinary Shares,$1.09,0.00,0.00%,7252944.00,China,,169,Consumer Staples,Retail-Drug Stores and Proprietary Stores
RDHL,Redhill Biopharma Ltd. American Depositary Shares,$2.097,0.037,1.796%,4805389.00,Israel,,16476,Health Care,Biotechnology: Pharmaceutical Preparations
RDI,Reading International Inc Class A Common Stock,$1.28,0.04,3.226%,28769834.00,United States,,31468,Consumer Discretionary,Movies/Entertainment
RDIB,Reading International Inc Class B Common Stock,$10.39,0.39,3.90%,233530139.00,United States,,2831,Consumer Discretionary,Movies/Entertainment
RDN,Radian Group Inc. Common Stock,$35.64,-0.06,-0.168%,4787668179.00,United States,,1032303,Finance,Property-Casualty Insurers
RDNT,RadNet Inc. Common Stock,$55.32,0.06,0.109%,4150665021.00,United States,,640461,Health Care,Medical Specialities
RDUS,Radius Recycling Inc. Class A Common Stock,$29.98,0.27,0.909%,847164677.00,United States,,1548897,Consumer Discretionary,Industrial Specialties
RDVT,Red Violet Inc. Common Stock ,$49.37,-0.71,-1.418%,689003672.00,United States,,98859,Technology,Computer Software: Prepackaged Software
RDW,Redwire Corporation Common Stock,$15.15,-0.33,-2.132%,1167813389.00,United States,2021,3925168,Industrials,Military/Government/Technical
RDWR,Radware Ltd. Ordinary Shares,$30.80,0.55,1.818%,1314745247.00,Israel,1999,396661,Consumer Discretionary,Business Services
RDY,Dr. Reddy's Laboratories Ltd Common Stock,$14.77,-0.31,-2.056%,12324905741.00,India,,1784975,Health Care,Biotechnology: Pharmaceutical Preparations
RDZN,Roadzen Inc. Ordinary Shares,$1.05,0.04,3.96%,78005535.00,United States,2022,317002,Finance,Specialty Insurers
RDZNW,Roadzen Inc. Warrants,$0.0511,-0.0019,-3.585%,3796269.00,United States,2022,9193,Finance,Specialty Insurers
REAL,The RealReal Inc. Common Stock,$5.30,0.06,1.145%,599405244.00,United States,2019,2557370,Consumer Discretionary,Other Specialty Stores
REAX,The Real Brokerage Inc. Common Shares,$4.11,-0.01,-0.243%,843721621.00,Canada,,569376,Finance,Real Estate
REBN,Reborn Coffee Inc. Common Stock,$3.10,0.42,15.672%,16440249.00,United States,2022,122764,Consumer Discretionary,Restaurants
RECT,Rectitude Holdings Ltd Ordinary Shares,$4.83,0.00,0.00%,70035000.00,Singapore,2024,634,Consumer Discretionary,Industrial Machinery/Components
REE,REE Automotive Ltd. Class A Ordinary Shares,$0.6602,0.0202,3.156%,20480019.00,Israel,,65643,Consumer Discretionary,Auto Manufacturing
REFI,Chicago Atlantic Real Estate Finance Inc. Common Stock,$13.96,-0.04,-0.286%,292705700.00,United States,2021,65439,Real Estate,Real Estate Investment Trusts
REFR,Research Frontiers Incorporated Common Stock,$1.49,-0.08,-5.096%,50135849.00,United States,,68297,Miscellaneous,Multi-Sector Companies
REG,Regency Centers Corporation Common Stock,$69.56,-0.36,-0.515%,12627177343.00,United States,1993,991590,Real Estate,Real Estate Investment Trusts
REGCO,Regency Centers Corporation 5.875% Series B Cumulative Redeemable Preferred Stock,$22.63,0.03,0.133%,4108007810.00,United States,,5919,Real Estate,Real Estate Investment Trusts
REGCP,Regency Centers Corporation 6.25% Series A Cumulative Redeemable Preferred Stock,$23.73,0.00,0.00%,4307690028.00,United States,,352,Real Estate,Real Estate Investment Trusts
REGN,Regeneron Pharmaceuticals Inc. Common Stock,$547.75,9.64,1.791%,59138100982.00,United States,1991,847055,Health Care,Biotechnology: Pharmaceutical Preparations
REI,Ring Energy Inc. Common Stock,$0.7804,0.0014,0.18%,161171726.00,United States,,2920994,Energy,Oil & Gas Production
REKR,Rekor Systems Inc. Common Stock,$1.21,-0.04,-3.20%,142871892.00,United States,,3350916,Telecommunications,Telecommunications Equipment
RELI,Reliance Global Group Inc. Common Stock,$1.60,0.02,1.266%,4759854.00,United States,,145299,Finance,Specialty Insurers
RELIW,Reliance Global Group Inc. Series A Warrants,$0.0448,0.0204,83.607%,133276.00,United States,,836,Finance,Specialty Insurers
RELL,Richardson Electronics Ltd. Common Stock,$9.89,0.18,1.854%,142168750.00,United States,1983,23836,Technology,Electronic Components
RELX,RELX PLC PLC American Depositary Shares (Each representing One Ordinary Share),$53.55,0.11,0.206%,98526961159.00,United Kingdom,2015,942356,Consumer Discretionary,Business Services
RELY,Remitly Global Inc. Common Stock,$18.35,-0.17,-0.918%,3740805163.00,United States,2021,3242989,Consumer Discretionary,Business Services
RENB,Renovaro Inc. Common Stock,$0.3057,0.0092,3.103%,52616647.00,United States,,1173503,Health Care,Biotechnology: Pharmaceutical Preparations
RENT,Rent the Runway Inc. Class A Common Stock,$5.07,0.06,1.198%,20390972.00,United States,2021,27380,Consumer Discretionary,Other Specialty Stores
REPL,Replimune Group Inc. Common Stock,$9.34,-0.31,-3.212%,719990245.00,United States,2018,1287888,Health Care,Biotechnology: Biological Products (No Diagnostic Substances)
REPX,Riley Exploration Permian Inc. Common Stock,$28.10,1.32,4.929%,618847312.00,United States,1999,193048,Energy,Oil & Gas Production
RERE,ATRenew Inc. American Depositary Shares (every three of which representing two Class A ordinary shares),$4.06,0.27,7.124%,892454328.00,Cayman Islands,2021,8876316,Consumer Discretionary,Other Specialty Stores
RES,RPC Inc. Common Stock,$5.39,0.26,5.068%,1188842687.00,United States,,2503459,Energy,Oilfield Services/Equipment
RETO,ReTo Eco-Solutions Inc. Class A Shares,$2.49,0.27,12.162%,19083059.00,China,2017,67306,Industrials,Industrial Machinery/Components
REVB,Revelation Biosciences Inc. Common Stock,$2.51,-0.0697,-2.702%,1698263.00,United States,2020,363184,Health Care,Biotechnology: Pharmaceutical Preparations
REVBW,Revelation Biosciences Inc. Warrant,$0.0103,-0.0008,-7.207%,6969.00,United States,2020,21330,Health Care,Biotechnology: Pharmaceutical Preparations
REVG,REV Group Inc. Common Stock,$49.68,-0.12,-0.241%,2424252398.00,United States,2017,1075834,Consumer Discretionary,Auto Manufacturing
REX,REX American Resources Corporation,$53.05,0.27,0.512%,873672970.00,United States,,95019,Industrials,Major Chemicals
REXR,Rexford Industrial Realty Inc. Common Stock,$36.95,0.22,0.599%,8745512524.00,United States,2013,4471666,Real Estate,Real Estate Investment Trusts
REXR^B,Rexford Industrial Realty Inc. 5.875% Series B Cumulative Redeemable Preferred Stock,$22.35,-0.35,-1.542%,,United States,,3428,,
REXR^C,Rexford Industrial Realty Inc. 5.625% Series C Cumulative Redeemable Preferred Stock par value $0.01 per share,$20.94,0.015,0.072%,,United States,,8590,,
REYN,Reynolds Consumer Products Inc. Common Stock,$21.68,0.10,0.463%,4559808559.00,United States,2020,1072344,Consumer Discretionary,Containers/Packaging
REZI,Resideo Technologies Inc. Common Stock ,$23.75,0.25,1.064%,3526958933.00,United States,2018,1201626,Industrials,Wholesale Distributors
