Symbol,Name,Last Sale,Net Change,% Change,Market Cap,Country,IPO Year,Volume,Sector,Industry
DIBS,1stdibs.com Inc. Common Stock,$2.72,-0.02,-0.73%,97060613.00,United States,2021,119617,Consumer Discretionary,Catalog/Specialty Distribution
DIN,Dine Brands Global Inc. Common Stock,$25.84,0.44,1.732%,403770129.00,United States,,268476,Consumer Discretionary,Restaurants
DINO,HF Sinclair Corporation Common Stock,$44.88,0.53,1.195%,8455830926.00,United States,1960,3700763,Energy,Natural Gas Distribution
DIOD,Diodes Incorporated Common Stock,$57.06,2.44,4.467%,2647661487.00,United States,,448396,Technology,Semiconductors
DIS,Walt Disney Company (The) Common Stock,$121.82,-1.34,-1.088%,219001455606.00,United States,,6619099,Consumer Discretionary,Services-Misc. Amusement & Recreation
DIT,AMCON Distributing Company Common Stock,$117.00,4.50,4.00%,75519054.00,United States,1999,1625,Consumer Discretionary,Food Distributors
DJCO,Daily Journal Corp. (S.C.) Common Stock,$401.90,2.81,0.704%,553587509.00,United States,,89683,Consumer Discretionary,Newspapers/Magazines
DJT,Trump Media & Technology Group Corp. Common Stock,$19.25,0.52,2.776%,4247021779.00,United States,2024,9180981,Technology,Computer Software: Programming Data Processing
DJTWW,Trump Media & Technology Group Corp. Warrants,$11.425,0.025,0.219%,2520635004.00,United States,2021,57565,Technology,Computer Software: Programming Data Processing
DK,Delek US Holdings Inc. Common Stock,$23.99,0.27,1.138%,1456847687.00,United States,2017,1500767,Energy,Integrated oil Companies
DKL,Delek Logistics Partners L.P. Common Units representing Limited Partner Interests,$44.61,0.86,1.966%,2383993553.00,United States,2012,101041,Energy,Natural Gas Distribution
DKNG,DraftKings Inc. Class A Common Stock,$42.34,1.76,4.337%,21012733617.00,United States,2019,10435900,Consumer Discretionary,Services-Misc. Amusement & Recreation
DKS,Dick's Sporting Goods Inc Common Stock,$207.67,0.73,0.353%,16623383541.00,United States,2002,1039350,Consumer Discretionary,Other Specialty Stores
DLB,Dolby Laboratories Common Stock,$75.59,0.85,1.137%,7261643151.00,United States,2005,401792,Miscellaneous,Multi-Sector Companies
DLHC,DLH Holdings Corp.,$5.73,0.09,1.596%,82434462.00,United States,,14437,Consumer Discretionary,Professional Services
DLNG,Dynagas LNG Partners LP Common Units,$3.614,-0.106,-2.849%,132553504.00,Greece,,79524,Consumer Discretionary,Marine Transportation
DLNG^A,Dynagas LNG Partners LP 9.00% Series A Cumulative Redeemable Preferred Units,$25.5999,0.0999,0.392%,,Greece,,1604,,
DLNG^B,Dynagas LNG Partners LP 8.75% Series B Fixed to Floating Rate Cumulative Redeemable Perpetual Preferred Units liquidation preference $25.00 per Uni,$25.3746,0.0046,0.018%,,Greece,,2058,,
DLO,DLocal Limited Class A Common Shares,$11.34,-0.23,-1.988%,3237288042.00,Uruguay,2021,1067261,Consumer Discretionary,Business Services
DLPN,Dolphin Entertainment Inc. Common Stock,$1.34,-0.01,-0.741%,14965279.00,United States,,35350,Consumer Discretionary,Other Consumer Services
DLR,Digital Realty Trust Inc. Common Stock,$170.80,-0.84,-0.489%,57523986321.00,United States,2004,1266567,Real Estate,Real Estate Investment Trusts
DLR^J,Digital Realty Trust Inc. 5.250% Series J Cumulative Redeemable Preferred Stock,$21.35,0.05,0.235%,,United States,,9471,,
DLR^K,Digital Realty Trust Inc. 5.850% Series K Cumulative Redeemable Preferred Stock par value $0.01 per share,$23.37,0.055,0.236%,,United States,,7998,,
DLR^L,Digital Realty Trust Inc. 5.200% Series L Cumulative Redeemable Preferred Stock,$20.36,-0.02,-0.098%,,United States,,14323,,
DLTH,Duluth Holdings Inc. Class B Common Stock,$2.20,0.08,3.774%,82673492.00,United States,2015,44138,Consumer Discretionary,Clothing/Shoe/Accessory Stores
DLTR,Dollar Tree Inc. Common Stock,$104.39,0.16,0.154%,21785756441.00,United States,1995,3463288,Consumer Discretionary,Department/Specialty Retail Stores
DLX,Deluxe Corporation Common Stock,$16.73,0.24,1.455%,748497523.00,United States,,530920,Consumer Discretionary,Publishing
DLY,DoubleLine Yield Opportunities Fund Common Shares of Beneficial Interest,$15.48,-0.01,-0.065%,742200659.00,United States,2020,128075,Finance,Investment Managers
DMA,Destra Multi-Alternative Fund Common Stock,$8.69,0.03,0.346%,0.00,,2022,4430,Finance,Trusts Except Educational Religious and Charitable
DMAA,Drugs Made In America Acquisition Corp. Ordinary Shares,$10.24,0.04,0.392%,0.00,United States,2025,44393,,
DMAAU,Drugs Made In America Acquisition Corp. Units,$10.382,0.00,0.00%,0.00,United States,2025,80,,
DMAC,DiaMedica Therapeutics Inc. Common Stock,$3.65,0.02,0.551%,156524647.00,United States,2018,104850,Health Care,Biotechnology: Pharmaceutical Preparations
DMB,BNY Mellon Municipal Bond Infrastructure Fund Inc. Common Stock,$10.21,0.00,0.00%,0.00,,2013,37620,Finance,Trusts Except Educational Religious and Charitable
DMLP,Dorchester Minerals L.P. Common Units Representing Limited Partnership Interests,$27.92,0.46,1.675%,1321725988.00,United States,,47335,Energy,Oil & Gas Production
DMO,Western Asset Mortgage Opportunity Fund Inc. Common Stock,$11.95,-0.02,-0.167%,0.00,United States,2010,33143,Finance,Trusts Except Educational Religious and Charitable
DMRC,Digimarc Corporation Common Stock,$13.06,0.00,0.00%,281469133.00,United States,,114622,Technology,EDP Services
DMYY,dMY Squared Technology Group Inc. Class A Common Stock,$13.00,0.265,2.081%,0.00,,2022,113810,Finance,Blank Checks
DNA,Ginkgo Bioworks Holdings Inc. Class A Common Stock,$11.13,-0.22,-1.938%,651459791.00,United States,2021,1165628,Health Care,Biotechnology: Biological Products (No Diagnostic Substances)
DNB,Dun & Bradstreet Holdings Inc. Common Stock,$9.12,0.01,0.11%,4071392124.00,United States,2020,1478355,Finance,Finance: Consumer Services
DNLI,Denali Therapeutics Inc. Common Stock,$14.33,0.08,0.561%,2081809365.00,United States,2017,807094,Health Care,Biotechnology: Biological Products (No Diagnostic Substances)
DNN,Denison Mines Corp Ordinary Shares (Canada),$1.73,-0.08,-4.42%,1550676056.00,Canada,,103503187,Basic Materials,Other Metals and Minerals
DNOW,DNOW Inc. Common Stock,$14.15,0.48,3.511%,1493789606.00,United States,2014,1628172,Industrials,Metal Fabrications
DNP,DNP Select Income Fund Inc. Common Stock,$9.65,-0.11,-1.127%,0.00,United States,1987,773489,Finance,Investment Managers
DNTH,Dianthus Therapeutics Inc. Common Stock,$18.25,0.00,0.00%,586919672.00,United States,2018,241991,Health Care,Biotechnology: Pharmaceutical Preparations
DNUT,Krispy Kreme Inc. Common Stock,$3.33,0.20,6.39%,568764000.00,United States,2021,3731439,Consumer Staples,Food Chains
DOC,Healthpeak Properties Inc. Common Stock,$18.21,0.23,1.279%,12651071650.00,United States,,5116710,Real Estate,Real Estate Investment Trusts
DOCN,DigitalOcean Holdings Inc. Common Stock,$29.46,0.59,2.044%,2681847735.00,United States,2021,1564789,Technology,Computer Software: Programming Data Processing
DOCS,Doximity Inc. Class A Common Stock,$61.47,0.61,1.002%,11545673625.00,United States,2021,1670873,Technology,EDP Services
DOCU,DocuSign Inc. Common Stock,$77.95,0.31,0.399%,15750793077.00,United States,1989,1878780,Technology,Computer Software: Prepackaged Software
DOGZ,Dogness (International) Corporation Class A Common Stock,$10.03,0.57,6.025%,127688500.00,China,2017,198904,Consumer Discretionary,Miscellaneous manufacturing industries
DOLE,Dole plc Ordinary Shares,$14.00,-0.13,-0.92%,1331932476.00,Ireland,2021,520141,Consumer Staples,Farming/Seeds/Milling
DOMH,Dominari Holdings Inc. Common Stock,$5.04,-0.06,-1.176%,74108387.00,United States,,126269,Health Care,Biotechnology: Pharmaceutical Preparations
DOMO,Domo Inc. Class B Common Stock,$14.94,-0.21,-1.386%,601111916.00,United States,2018,650462,Technology,Computer Software: Prepackaged Software
DOOO,BRP Inc. (Recreational Products) Common Subordinate Voting Shares,$50.65,-0.28,-0.55%,3704137522.00,Canada,,158329,Consumer Discretionary,Industrial Specialties
DORM,Dorman Products Inc. Common Stock,$124.04,-0.85,-0.681%,3784606023.00,United States,,169431,Consumer Discretionary,Auto Parts:O.E.M.
DOUG,Douglas Elliman Inc. Common Stock,$2.45,0.07,2.941%,217407703.00,United States,2021,1119921,Finance,Real Estate
DOV,Dover Corporation Common Stock,$188.43,1.06,0.566%,25834575874.00,United States,,892749,Industrials,Industrial Machinery/Components
DOW,Dow Inc. Common Stock ,$29.06,1.58,5.75%,20541402106.00,United States,2019,18302779,Industrials,Major Chemicals
DOX,Amdocs Limited Ordinary Shares,$92.62,0.80,0.871%,10455924038.00,Guernsey,,740212,Technology,EDP Services
DOYU,DouYu International Holdings Limited ADS,$7.06,0.07,1.001%,213062745.00,China,2019,80373,Technology,Computer Software: Programming Data Processing
DPG,Duff & Phelps Utility and Infrastructure Fund Inc.,$12.22,-0.04,-0.326%,0.00,United States,2011,63842,Finance,Trusts Except Educational Religious and Charitable
DPRO,Draganfly Inc. Common Shares,$3.47,0.04,1.166%,18893432.00,Canada,,960709,Industrials,Aerospace
DPZ,Domino's Pizza Inc Common Stock,$459.43,6.21,1.37%,15731561778.00,United States,2004,600808,Consumer Discretionary,Food Distributors
DQ,DAQO New Energy Corp. American Depositary Shares each representing five ordinary shares,$19.32,1.87,10.716%,1295535734.00,China,2010,3170031,Technology,Semiconductors
DRCT,Direct Digital Holdings Inc. Class A Common Stock,$0.625,-0.015,-2.344%,11819675.00,United States,2022,77423,Consumer Discretionary,Advertising
DRD,DRDGOLD Limited American Depositary Shares,$13.32,-0.64,-4.585%,1151632162.00,South Africa,,469241,Basic Materials,Precious Metals
DRDB,Roman DBDR Acquisition Corp. II Ordinary shares,$10.27,-0.02,-0.194%,0.00,United States,2025,176261,,
DRDBW,Roman DBDR Acquisition Corp. II Warrants,$0.5248,-0.0002,-0.038%,0.00,United States,2025,684,,
DRH,Diamondrock Hospitality Company Common Stock,$7.94,0.10,1.276%,1638111293.00,United States,2005,2598934,Real Estate,Real Estate Investment Trusts
DRH^A,Diamondrock Hospitality Company 8.250% Series A Cumulative Redeemable Preferred Stock,$24.89,0.04,0.161%,,United States,,3687,,
DRI,Darden Restaurants Inc. Common Stock,$217.63,1.61,0.745%,25468421917.00,United States,,838117,Consumer Discretionary,Restaurants
DRIO,DarioHealth Corp. Common Stock,$0.7005,0.0002,0.029%,30786572.00,Israel,,138102,Health Care,Medical/Dental Instruments
DRMA,Dermata Therapeutics Inc. Common Stock,$0.63,-0.065,-9.353%,4018214.00,United States,2021,705708,Health Care,Biotechnology: Pharmaceutical Preparations
DRMAW,Dermata Therapeutics Inc. Warrant,$0.015,-0.0016,-9.639%,95672.00,United States,2021,2000,Health Care,Biotechnology: Pharmaceutical Preparations
DRRX,DURECT Corporation Common Stock,$0.624,-0.016,-2.50%,19370571.00,United States,2000,21435,Health Care,Biotechnology: Pharmaceutical Preparations
DRS,Leonardo DRS Inc. Common Stock,$46.44,-0.72,-1.527%,12355325080.00,Israel,,1608144,Industrials,Industrial Machinery/Components
DRTS,Alpha Tau Medical Ltd. Ordinary Shares,$3.23,-0.06,-1.824%,227329241.00,Israel,,20543,Health Care,Medical/Dental Instruments
DRTSW,Alpha Tau Medical Ltd. Warrant,$0.27,-0.005,-1.818%,19002754.00,Israel,,855,Health Care,Medical/Dental Instruments
DRUG,Bright Minds Biosciences Inc. Common Stock,$26.74,-0.59,-2.159%,186885566.00,Canada,,29733,Health Care,Biotechnology: Pharmaceutical Preparations
DRVN,Driven Brands Holdings Inc. Common Stock,$17.61,-0.15,-0.845%,2892889072.00,United States,2021,1240249,Consumer Discretionary,Automotive Aftermarket
DSGN,Design Therapeutics Inc. Common Stock,$3.64,0.10,2.825%,206637988.00,United States,2021,154453,Health Care,Biotechnology: Pharmaceutical Preparations
DSGR,Distribution Solutions Group Inc. Common Stock,$29.00,0.57,2.005%,1346711889.00,United States,,124128,Consumer Discretionary,Industrial Specialties
DSGX,Descartes Systems Group Inc. (The) Common Stock,$102.17,-0.18,-0.176%,8764431741.00,Canada,,474864,Technology,Computer Software: Prepackaged Software
DSL,DoubleLine Income Solutions Fund Common Shares of Beneficial Interests,$12.14,-0.01,-0.082%,1238241492.00,United States,2013,291514,Finance,Trusts Except Educational Religious and Charitable
DSM,BNY Mellon Strategic Municipal Bond Fund Inc. Common Stock,$5.64,0.01,0.178%,0.00,United States,1989,54303,Finance,Investment Managers
DSP,Viant Technology Inc. Class A Common Stock,$13.81,0.12,0.877%,864044525.00,United States,2021,138064,Technology,Computer Software: Programming Data Processing
DSS,DSS Inc. Common Stock,$0.8664,-0.0036,-0.414%,7877758.00,United States,,12871,Consumer Discretionary,Containers/Packaging
DSU,Blackrock Debt Strategies Fund Inc. Common Stock,$10.60,0.02,0.189%,0.00,United States,1998,432925,Finance,Finance Companies
DSWL,Deswell Industries Inc. Common Shares,$2.75,0.00,0.00%,43821907.00,Macau,1995,25196,Industrials,Plastic Products
DSX,Diana Shipping inc. common stock,$1.53,0.03,2.00%,177124827.00,Greece,2005,320690,Consumer Discretionary,Marine Transportation
DSX^B,Diana Shipping Inc. Perpetual Preferred Shares Series B (Marshall Islands),$26.76,0.125,0.469%,,Greece,,1130,,
DSY,Big Tree Cloud Holdings Limited Ordinary Shares,$1.30,-0.19,-12.752%,74204710.00,China,,41156,Consumer Discretionary,Containers/Packaging
DSYWW,Big Tree Cloud Holdings Limited Warrants,$0.0223,-0.0003,-1.327%,1272896.00,China,,3884,Consumer Discretionary,Containers/Packaging
DT,Dynatrace Inc. Common Stock,$56.26,-0.38,-0.671%,16859254393.00,United States,2019,3655043,Technology,Computer Software: Prepackaged Software
DTB,DTE Energy Company 2020 Series G 4.375% Junior Subordinated Debentures due 2080,$17.30,0.02,0.116%,3590021299.00,United States,2020,15528,Utilities,Electric Utilities: Central
DTCK,Davis Commodities Limited Ordinary Shares,$0.815,-0.003,-0.367%,19968009.00,Singapore,2023,37226,Industrials,Farming/Seeds/Milling
DTE,DTE Energy Company Common Stock,$130.26,-0.87,-0.663%,27030992737.00,United States,,1548727,Utilities,Electric Utilities: Central
DTF,DTF Tax-Free Income 2028 Term Fund Inc. Common Stock,$11.23,0.01,0.089%,78942037.00,United States,1991,9918,Finance,Investment Managers
DTG,DTE Energy Company 2021 Series E 4.375% Junior Subordinated Debentures,$17.42,0.02,0.115%,3614923180.00,United States,2021,21810,Utilities,Electric Utilities: Central
DTI,Drilling Tools International Corporation Common Stock,$2.86,0.13,4.762%,101795228.00,United States,2021,20129,Industrials,Metal Fabrications
DTIL,Precision BioSciences Inc. Common Stock,$4.52,0.21,4.872%,50118818.00,United States,2019,189923,Health Care,Biotechnology: Biological Products (No Diagnostic Substances)
DTM,DT Midstream Inc. Common Stock ,$102.80,-2.00,-1.908%,10443522521.00,United States,2021,1334224,Utilities,Natural Gas Distribution
DTSQ,DT Cloud Star Acquisition Corporation Ordinary Shares,$10.3833,0.00,0.00%,0.00,United States,2024,1,,
DTSQR,DT Cloud Star Acquisition Corporation Right,$0.14,0.00,0.00%,0.00,United States,2024,5000,,
DTSS,Datasea Inc. Common Stock,$1.9999,0.0649,3.354%,15306977.00,China,,21934,Technology,Computer Software: Prepackaged Software
DTST,Data Storage Corporation Common Stock,$3.52,-0.01,-0.283%,25132423.00,United States,,26823,Technology,EDP Services
DTSTW,Data Storage Corporation Warrant,$0.15,-0.0829,-35.595%,1070984.00,United States,,1410,Technology,EDP Services
DTW,DTE Energy Company 2017 Series E 5.25% Junior Subordinated Debentures due 2077,$21.19,-0.03,-0.141%,4397257302.00,United States,2017,30395,Utilities,Electric Utilities: Central
DUK,Duke Energy Corporation (Holding Company) Common Stock,$116.31,-0.98,-0.836%,90402774115.00,United States,,3135093,Utilities,Power Generation
DUK^A,Duke Energy Corporation Depositary Shares each representing a 1/1000th interest in a share of 5.75% Series A Cumulative Redeemable Perpetual Preferred Stock,$24.70,0.06,0.244%,,United States,,56838,,
DUKB,Duke Energy Corporation 5.625% Junior Subordinated Debentures due 2078,$23.91,0.07,0.294%,18584217428.00,United States,2018,16063,Utilities,Power Generation
DUO,Fangdd Network Group Ltd. Class A Ordinary Shares,$2.42,0.11,4.762%,9449047.00,China,2019,146062,Finance,Real Estate
DUOL,Duolingo Inc. Class A Common Stock,$389.45,-7.00,-1.766%,17702155715.00,United States,2021,1445177,Technology,Computer Software: Prepackaged Software
DUOT,Duos Technologies Group Inc. Common Stock,$7.75,-0.10,-1.274%,90317764.00,United States,,95440,Technology,Computer Software: Prepackaged Software
DV,DoubleVerify Holdings Inc. Common Stock,$15.43,0.01,0.065%,2507415133.00,United States,2021,2245433,Technology,Computer Software: Programming Data Processing
DVA,DaVita Inc. Common Stock,$143.80,0.99,0.693%,10856900000.00,United States,,826685,Health Care,Misc Health and Biotechnology Services
DVAX,Dynavax Technologies Corporation Common Stock,$10.59,0.29,2.816%,1271654084.00,United States,2004,1896553,Health Care,Biotechnology: Pharmaceutical Preparations
DVLT,Datavault AI Inc. Common Stock,$0.7157,0.0414,6.14%,47253513.00,United States,2018,452585,Technology,Semiconductors
DVN,Devon Energy Corporation Common Stock,$34.92,2.24,6.854%,22422132000.00,United States,1985,16158122,Energy,Oil & Gas Production
DVS,Dolly Varden Silver Corporation Common Shares,$3.47,-0.07,-1.977%,276274623.00,,2025,237386,,
DWSN,Dawson Geophysical Company Common Stock,$1.32,-0.01,-0.752%,40899094.00,United States,,165852,Energy,Oil & Gas Production
DWTX,Dogwood Therapeutics Inc. Common Stock,$4.84,0.24,5.217%,9249860.00,United States,2020,42755,Health Care,Biotechnology: Pharmaceutical Preparations
DX,Dynex Capital Inc. Common Stock,$12.75,0.02,0.157%,1342975860.00,United States,,3435015,Real Estate,Real Estate Investment Trusts
DX^C,Dynex Capital Inc. 6.900% Series C Fixed-to-Floating Rate Cumulative Redeemable Preferred Stock,$25.2263,-0.0037,-0.015%,,United States,,8467,,
DXC,DXC Technology Company Common Stock ,$16.04,0.45,2.886%,2907511516.00,United States,,1730762,Technology,EDP Services
DXCM,DexCom Inc. Common Stock,$83.76,0.82,0.989%,32842924284.00,United States,2005,3017876,Health Care,Medical/Dental Instruments
DXF,Eason Technology Limited American Depositary Shares (each representing sixty-thousand (60000) Ordinary Shares),$5.18,0.22,4.435%,1292224.00,,,5190,Finance,Finance: Consumer Services
DXLG,Destination XL Group Inc. Common Stock,$1.17,-0.05,-4.098%,62963555.00,United States,,159146,Consumer Discretionary,Clothing/Shoe/Accessory Stores
DXPE,DXP Enterprises Inc. Common Stock,$89.92,0.82,0.92%,1411230557.00,United States,,141815,Industrials,Industrial Machinery/Components
DXR,Daxor Corporation Common Stock,$9.35,-0.51,-5.172%,45254000.00,United States,,2092,Health Care,Medical/Dental Instruments
DXST,Decent Holding Inc Class A Ordinary Shares,$1.23,-0.07,-5.385%,19987500.00,China,2025,70172,Industrials,Miscellaneous
DXYZ,Destiny Tech100 Inc. Common Stock,$36.98,1.69,4.789%,0.00,,2024,447033,,
DY,Dycom Industries Inc. Common Stock,$248.96,-3.17,-1.257%,7201127420.00,United States,,340993,Industrials,Water Sewer Pipeline Comm & Power Line Construction
DYAI,Dyadic International Inc. Common Stock,$0.933,0.0175,1.912%,28074587.00,United States,,50440,Health Care,Biotechnology: Biological Products (No Diagnostic Substances)
DYCQ,DT Cloud Acquisition Corporation Ordinary Shares,$10.875,0.00,0.00%,0.00,United Kingdom,2024,52,,
DYCQR,DT Cloud Acquisition Corporation Right,$0.23,0.02,9.524%,0.00,United Kingdom,2024,500,,
DYN,Dyne Therapeutics Inc. Common Stock,$8.39,0.21,2.567%,953662589.00,United States,2020,3737862,Health Care,Biotechnology: Pharmaceutical Preparations
DYNX,Dynamix Corporation Class A Ordinary Shares,$10.21,0.00,0.00%,0.00,United States,2024,4,,
DYNXU,Dynamix Corporation Unit,$10.31,0.00,0.00%,0.00,United States,2024,61,,
DYNXW,Dynamix Corporation Warrant,$0.3401,0.00,0.00%,0.00,United States,2024,9,,
E,ENI S.p.A. Common Stock,$33.24,0.69,2.12%,54588232542.00,Italy,,266041,Energy,Oil & Gas Production
EA,Electronic Arts Inc. Common Stock,$152.64,-0.89,-0.58%,38276917966.00,United States,,1710453,Technology,Computer Software: Prepackaged Software
EAD,Allspring Income Opportunities Fund Common Shares,$7.10,0.01,0.141%,0.00,United States,2003,87386,Finance,Finance/Investors Services
EAF,GrafTech International Ltd. Common Stock,$0.9517,0.0305,3.311%,245646101.00,United States,2018,2738953,Energy,Industrial Machinery/Components
EAI,Entergy Arkansas LLC First Mortgage Bonds 4.875% Series Due September 1 2066,$20.50,-0.01,-0.049%,8830869235.00,United States,2016,11451,Utilities,Electric Utilities: Central
EARN,Ellington Credit Company Common Shares of Beneficial Interest,$5.83,0.07,1.215%,218970107.00,United States,2013,255309,Real Estate,Real Estate Investment Trusts
EAT,Brinker International Inc. Common Stock,$171.28,-2.14,-1.234%,7613593486.00,United States,,1156605,Consumer Discretionary,Restaurants
EB,Eventbrite Inc. Class A Common Stock,$2.63,0.01,0.382%,252188396.00,United States,2018,514519,Technology,Computer Software: Programming Data Processing
EBAY,eBay Inc. Common Stock,$75.33,-0.58,-0.764%,34727130000.00,United States,1998,3405273,Consumer Discretionary,Business Services
EBC,Eastern Bankshares Inc. Common Stock,$16.00,0.17,1.074%,3377439152.00,United States,2020,1225640,Finance,Savings Institutions
EBF,Ennis Inc. Common Stock,$18.40,0.00,0.00%,474630962.00,United States,,199881,Consumer Discretionary,Office Equipment/Supplies/Services
EBMT,Eagle Bancorp Montana Inc. Common Stock,$17.57,-0.08,-0.453%,139719750.00,United States,2010,41695,Finance,Major Banks
EBON,Ebang International Holdings Inc. Class A Ordinary Shares,$3.3677,-0.0235,-0.693%,22038020.00,China,2020,5371,Technology,Semiconductors
EBR,Centrais Electricas Brasileiras S A American Depositary Shares (Each representing one Common Share),$7.31,-0.05,-0.679%,16395443955.00,Brazil,2016,878422,Utilities,Electric Utilities: Central
EBS,Emergent BioSolutions Inc. Common Stock,$6.87,0.25,3.776%,372888671.00,United States,2006,930899,Health Care,Biotechnology: Pharmaceutical Preparations
EC,Ecopetrol S.A. American Depositary Shares,$9.11,0.24,2.706%,18728654436.00,Colombia,,2139068,Energy,Oil & Gas Production
ECAT,BlackRock ESG Capital Allocation Term Trust Common Shares of Beneficial Interest,$16.31,0.07,0.431%,1763681850.00,United States,2021,305278,Finance,Trusts Except Educational Religious and Charitable
ECBK,ECB Bancorp Inc. Common Stock,$16.22,0.01,0.062%,146428986.00,United States,2022,27132,Finance,Banks
ECC           ,Eagle Point Credit Company Inc. Common Stock,$7.79,0.04,0.516%,472561062.00,United States,2014,1949966,Finance,Trusts Except Educational Religious and Charitable
ECC^D,Eagle Point Credit Company Inc. 6.75% Series D Preferred Stock,$19.81,-0.04,-0.202%,,United States,,30040,,
ECCC,Eagle Point Credit Company Inc. 6.50% Series C Term Preferred Stock due 2031,$23.3038,-0.0362,-0.155%,1413667327.00,United States,,4336,Finance,Trusts Except Educational Religious and Charitable
ECCF,Eagle Point Credit Company Inc. 8.00% Series F Term Preferred Stock due 2029,$25.04,0.0299,0.12%,27260367613.00,United States,,2430,,
ECCU,Eagle Point Credit Company Inc. 7.75% Notes due 2030,$24.75,-0.10,-0.402%,0.00,United States,2024,32424,,
ECCV,Eagle Point Credit Company Inc. 5.375% Notes due 2029,$23.20,-0.05,-0.215%,1407370557.00,United States,2022,3988,Finance,Trusts Except Educational Religious and Charitable
ECCW,Eagle Point Credit Company Inc. 6.75% Notes due 2031,$23.65,0.0263,0.111%,1434668693.00,United States,2021,947,Finance,Trusts Except Educational Religious and Charitable
ECCX,Eagle Point Credit Company Inc. 6.6875% Notes due 2028,$24.672,0.2221,0.908%,1496665792.00,United States,2022,5107,Finance,Trusts Except Educational Religious and Charitable
ECDA,ECD Automotive Design Inc. Common Stock,$0.2831,0.0187,7.073%,10017681.00,United States,2022,2868799,Consumer Discretionary,Auto Manufacturing
ECDAW,ECD Automotive Design Inc. Warrant ,$0.025,0.005,25.00%,884642.00,United States,2022,2949,Consumer Discretionary,Auto Manufacturing
ECF,Ellsworth Growth and Income Fund Ltd.,$10.204,-0.051,-0.497%,0.00,United States,1986,37611,Finance,Finance/Investors Services
ECF^A,Ellsworth Growth and Income Fund Ltd. 5.25% Series A Cumulative Preferred Shares (Liquidation Preference $25.00 per share),$21.6539,-0.044,-0.203%,,United States,,1220,,
ECG,Everus Construction Group Inc. Common Stock,$65.31,0.96,1.492%,3330782635.00,United States,2024,433335,Consumer Discretionary,Homebuilding
ECL,Ecolab Inc. Common Stock,$268.90,-2.88,-1.06%,76236542980.00,United States,,1335662,Consumer Discretionary,Package Goods/Cosmetics
ECO,Okeanis Eco Tankers Corp. Common Stock,$23.36,-0.71,-2.95%,752054363.00,,,130125,Consumer Discretionary,Marine Transportation
ECOR,electroCore Inc. Common Stock,$7.10,1.01,16.585%,52686388.00,United States,2018,528173,Health Care,Biotechnology: Electromedical & Electrotherapeutic Apparatus
ECPG,Encore Capital Group Inc Common Stock,$40.58,0.41,1.021%,947510536.00,United States,,272210,Finance,Finance Companies
ECVT,Ecovyst Inc. Common Stock,$8.52,-0.14,-1.617%,1000252345.00,United States,2017,1503192,Industrials,Major Chemicals
ECX,ECARX Holdings Inc. Class A Ordinary shares,$2.24,0.13,6.161%,774435258.00,China,,5541979,Technology,EDP Services
ECXWW,ECARX Holdings Inc. Warrants,$0.075,0.00,0.00%,25929752.00,China,,14585,Technology,EDP Services
ED,Consolidated Edison Inc. Common Stock,$99.31,-0.40,-0.401%,35781008074.00,United States,,3451188,Utilities,Power Generation
EDAP,EDAP TMS S.A. American Depositary Shares,$1.534,-0.036,-2.293%,57359460.00,France,1997,62827,Health Care,Biotechnology: Electromedical & Electrotherapeutic Apparatus
EDBL,Edible Garden AG Incorporated Common Stock,$2.67,0.08,3.089%,4419555.00,United States,2022,113922,Consumer Staples,Farming/Seeds/Milling
EDBLW,Edible Garden AG Incorporated Warrant,$0.0999,-0.0221,-18.115%,165361.00,United States,2022,22520,Consumer Staples,Farming/Seeds/Milling
EDD,Morgan Stanley Emerging Markets Domestic Debt Fund Inc. Common Stock,$5.14,-0.04,-0.772%,0.00,United States,2007,269890,Finance,Finance Companies
